{"verdict": "partially_valid", "confidence": 0.97, "explanation": "The DOI, year, venue, and first author point to a real Advanced Science 2023 paper, but that paper is titled “Selective Translation of Maternal mRNA by eIF4E1B Controls Oocyte to Embryo Transition” and has a different author list. Web searches for the claimed exact title did not find a matching paper, suggesting the citation has real DOI metadata mixed with a fabricated or paraphrased title/authors.", "matched_identifier": "10.1002/advs.202205500", "mismatches": ["title: claimed \"The eIF4E1B-eIF4ENIF1 complex is essential for mouse oocyte and early embryo development\", actual \"Selective Translation of Maternal mRNA by eIF4E1B Controls Oocyte to Embryo Transition\"", "authors: claimed Guo J, Zhang T, Guo Y, Sun T, Li H, Zhang X, et al.; actual Guo J, Zhao H, Zhang J, Lv X, Zhang S, Su R, Zheng W, Dai J, Meng F, Gong F, Lu G, Xue Y, Lin G"], "search_attempts": ["reviewed API evidence", "web searched: \"The eIF4E1B-eIF4ENIF1 complex is essential for mouse oocyte and early embryo development\"", "web searched: \"10.1002/advs.202205500\"", "web searched: \"eIF4E1B-eIF4ENIF1\" \"oocyte\"", "web searched: \"mouse oocyte and early embryo development\" \"eIF4E1B\""]}
