{"verdict": "valid", "confidence": 1, "explanation": "Crossref evidence contains a matching 2007 Journal of Biological Chemistry article with the same title, author list, year, and DOI. The only differences are formatting/capitalization and expanded given names, which are not substantive discrepancies.", "matched_identifier": "10.1074/jbc.m704629200", "mismatches": [], "search_attempts": ["reviewed API evidence"]}
