{"verdict": "partially_valid", "confidence": 0.95, "explanation": "A real 2014 Science paper titled 'Genetic Screens in Human Cells Using the CRISPR-Cas9 System' exists at this exact venue, year, volume, issue, and page range, but the byline is Wang, Wei, Sabatini, Lander, not Patel and Kumar. Author attribution drift on otherwise correct metadata.", "matched_identifier": "10.1126/science.1246981", "mismatches": ["authors: claimed Patel R, Kumar S; actual authors Tim Wang, Jenny J. Wei, David M. Sabatini, Eric S. Lander"], "search_attempts": ["reviewed API evidence"]}
