{"verdict": "valid", "confidence": 1.0, "explanation": "Channel A confirmed an exact Crossref match for the candidate (Doench et al. 2016, Nat Biotechnol, DOI 10.1038/nbt.3437). The winner's metadata aligns with the original citation's claim about off-target prediction, so the replacement is sound.", "matched_identifier": "10.1038/nbt.3437", "mismatches": [], "search_attempts": ["reviewed API evidence"]}
