{"verdict": "partially_valid", "confidence": 0.98, "explanation": "The DOI resolves to a real 2019 Journal of Ovarian Research article with the exact cited title. However, the official author list is Minying Zhao, Fan Feng, Chunfang Chu, Wentao Yue, and Lin Li, while the citation lists Zhao S, Li G, Dalgleish R, Vujovic S, Jiao X, and Li J. This is a real paper, but the cited author list appears to be incorrect.", "matched_identifier": "https://doi.org/10.1186/s13048-019-0595-0", "mismatches": ["authors: claimed Zhao S, Li G, Dalgleish R, Vujovic S, Jiao X, Li J et al.; actual Minying Zhao, Fan Feng, Chunfang Chu, Wentao Yue, Lin Li"], "search_attempts": ["reviewed API evidence", "web searched: \"A novel EIF4ENIF1 mutation associated with a diminished ovarian reserve and premature ovarian insufficiency identified by whole-exome sequencing\"", "web searched: \"10.1186/s13048-019-0595-0\"", "web searched: \"Zhao S\" \"Li G\" \"Dalgleish\" \"EIF4ENIF1\""]}
