{"verdict": "valid", "confidence": 1, "explanation": "The API evidence identifies the well-known 2017 Neural Information Processing Systems paper \"Attention is All You Need\" with matching title, year, venue, and the cited lead authors; the remaining authors are covered by the citation's \"et al.\" No substantive discrepancies were found.", "matched_identifier": "https://www.semanticscholar.org/paper/204e3073870fae3d05bcbc2f6a8e263d9b72e776", "mismatches": [], "search_attempts": ["reviewed API evidence"]}
