{"verdict": "partially_valid", "confidence": 0.96, "explanation": "A real 2023 Development paper exists with the exact title and DOI 10.1242/dev.202151. However, the cited author list does not match the real paper: only Ding matches, while the actual authors are Ding, He, Sha, Kee, and Li.", "matched_identifier": "10.1242/dev.202151", "mismatches": ["authors: claimed Ding Y, Wang T, Chen T, Xie C, Zhang Q; actual Ding Yuxi, He Zequn, Sha Yanwei, Kee Kehkooi, Li Lin"], "search_attempts": ["reviewed API evidence", "web searched: \"Eif4enif1 haploinsufficiency disrupts oocyte mitochondrial dynamics and leads to subfertility\"", "web searched: \"10.1242/dev.202151\""]}
