{"verdict": "hallucinated", "confidence": 0.95, "explanation": "The supplied DOI (10.1038/nmeth.fakefake2024) does not resolve, and the claimed title 'A novel framework for citation hallucination detection in academic literature' does not appear in any indexed Nature Methods 2024 issue. Web searches returned no matching paper. The citation is fabricated.", "matched_identifier": null, "mismatches": [], "search_attempts": ["reviewed API evidence", "web searched: \"citation hallucination detection\" \"Nature Methods\" 2024"]}
