{"verdict": "valid", "confidence": 1, "explanation": "The Crossref record exactly matches the claimed title, year, venue, and DOI, and the listed citation authors are all present in the full author list. This is a real Science paper published in 2022.", "matched_identifier": "10.1126/science.abq4835", "mismatches": [], "search_attempts": ["reviewed API evidence"]}
