{"verdict": "valid", "confidence": 1, "explanation": "The Crossref record exactly matches the cited title, DOI, venue, and year, with the listed authors matching the cited author sequence and the raw citation using et al. for additional authors. This is a real Methods paper from 2020.", "matched_identifier": "10.1016/j.ymeth.2019.10.003", "mismatches": [], "search_attempts": ["reviewed API evidence"]}
