{"verdict": "valid", "confidence": 1, "explanation": "Crossref evidence exactly matches the cited title, DOI, year, and the listed authors, with additional authors consistent with the citation's \"et al.\" abbreviation. The venue abbreviation also matches Nature Structural & Molecular Biology.", "matched_identifier": "10.1038/nsmb.1838", "mismatches": [], "search_attempts": ["reviewed API evidence"]}
