{"verdict": "valid", "confidence": 1, "explanation": "The Crossref evidence exactly matches the cited title, year, DOI, and venue, and the listed citation authors match the first six authors of the indexed record. The additional indexed authors are consistent with the citation's use of \"et al.\"", "matched_identifier": "10.1038/nmeth.3810", "mismatches": [], "search_attempts": ["reviewed API evidence"]}
