{"verdict": "hallucinated", "confidence": 0.95, "explanation": "The supplied DOI (10.1038/nbt.fakefake2020) is non-resolving and the API evidence found no record. A web search for the exact title and the claimed author pair returned no Nature Biotechnology paper matching this citation. The paper appears fabricated.", "matched_identifier": null, "mismatches": [], "search_attempts": ["reviewed API evidence", "web searched: \"Universal off-target prediction model for CRISPR-Cas9 systems\" Lee Wang"]}
