{"verdict": "partially_valid", "confidence": 0.95, "explanation": "A real 2013 Science paper titled 'RNA-Guided Human Genome Engineering via Cas9' exists at this exact venue, year, and page range, but the byline is Mali, Yang, Esvelt et al., not Smith and Jones. The citation conflates real metadata with a fabricated author list.", "matched_identifier": "10.1126/science.1232033", "mismatches": ["authors: claimed Smith P, Jones K; actual lead author Prashant Mali with 8 authors total"], "search_attempts": ["reviewed API evidence"]}
