{"verdict": "valid", "confidence": 0.98, "explanation": "The Crossref evidence identifies a real 2015 Nature Methods paper by Michael J. Ziller et al. with a substantively matching title; the citation uses the abbreviation WGBS where the canonical title spells out whole-genome bisulfite sequencing. Year, venue, and lead author match.", "matched_identifier": "10.1038/nmeth.3152", "mismatches": [], "search_attempts": ["reviewed API evidence"]}
