{"verdict": "partially_valid", "confidence": 0.91, "explanation": "A real review by Maria Pia Campagna et al. exists with a substantially related full title, but it was published in Clinical Epigenetics in 2021, not Nature Reviews Genetics in 2018. Web search also surfaced Nature Reviews Genetics epigenetics reviews from 2018, but not this Campagna citation in that venue/year.", "matched_identifier": "https://doi.org/10.1186/s13148-021-01200-8", "mismatches": ["title: claimed \"EWAS: knowledge, strategies, recommendations\", actual \"Epigenome-wide association studies: current knowledge, strategies and recommendations\"", "year: claimed 2018, actual 2021", "venue: claimed Nat Rev Genet, actual Clinical Epigenetics"], "search_attempts": ["reviewed API evidence", "web searched: \"EWAS: knowledge, strategies, recommendations\" \"Campagna\"", "web searched: \"Campagna\" \"EWAS\" \"knowledge\" \"strategies\" \"recommendations\" \"2018\"", "web searched: \"Epigenome-wide association studies: current knowledge, strategies and recommendations\" Campagna", "web searched: \"Campagna MP\" \"Nat Rev Genet\" EWAS 2018", "web searched: \"Nature Reviews Genetics\" \"Epigenome-wide association studies\" \"2018\""]}
